{
  "$schema": "http://json-schema.org/draft-07/schema#",
  "title": "RegressionFixture",
  "type": "object",
  "required": ["id", "requirementId", "runner", "input", "expected"],
  "additionalProperties": false,
  "properties": { "id": {"type":"string"}, "requirementId": {"type":"string"}, "runner": {"type":"string"}, "input": {"type":"object"}, "expected": {"type":"object"} },
  "oneOf": [
    {"properties":{"runner":{"const":"sha256-known-vector"},"input":{"required":["text"]},"expected":{"required":["sha256"]}}},
    {"properties":{"runner":{"const":"callable-schema-validation"},"input":{"required":["path"]},"expected":{"required":["valid"]}}},
    {"properties":{"runner":{"const":"participant-index"},"input":{"required":["participants"]},"expected":{"required":["participantKeys"]}}},
    {"properties":{"runner":{"const":"submit-fact-idempotency"},"input":{"required":["case","request"]},"expected":{"required":["result","factWrites","receiptWrites"]}}},
    {"properties":{"runner":{"const":"association-transition"},"input":{"required":["case","documents","request"]},"expected":{"required":["result","factWrites","receiptWrites"]}}},
    {"properties":{"runner":{"enum":["query-index-mutation","documentation-mutation","version-governance-mutation","stride-manifest-mutation"]},"input":{"type":"object"},"expected":{"type":"object"}}}
  ]
}
