{
  "id": "callable-schema-validation",
  "requirementId": "version-specific-callable-compatibility",
  "runner": "callable-schema-validation",
  "input": {
    "path": "contracts/fixtures/compatibility/1.1.8/valid/submit-fact-command-request-association.json"
  },
  "expected": {
    "valid": true
  }
}
